<?xml version="1.0" encoding="UTF-8"?>
<crepusculo xmlns:xsi="http://www.w3.org/2001/XMLSchema-instance"
    xsi:noNamespaceSchemaLocation="crepusculo.xsd">

    <entrega numero="1">Crepusculo <actor nombre="Kristen Stewart" representaA="Bella"></actor>
        <actor
            nombre="Robert Pattinson" representaA="Edward"></actor>
        <actor nombre="Peter Facinelli"
            representaA="Carlisle"></actor>
    </entrega>
    <entrega numero="2">Luna Nueva <actor nombre="Kristen Stewart" representaA="Bella"></actor>
        <actor
            nombre="Robert Pattinson" representaA="Edward"></actor>
        <actor nombre="Peter Facinelli"
            representaA="Carlisle"></actor>
    </entrega>
    <entrega numero="3">Eclipse <actor nombre="Kristen Stewart" representaA="Bella">
            <humano />
        </actor>
        <actor nombre="Robert Pattinson" representaA="Edward">
            <vampiro />
        </actor>
        <actor nombre="Peter Facinelli" representaA="Carlisle"></actor>
    </entrega>
    <entrega numero="4">Amanecer (primera parte) <actor nombre="Kristen Stewart"
            representaA="Bella">
            <humano />
        </actor>
        <actor nombre="Robert Pattinson" representaA="Edward">
            <vampiro />
        </actor>
        <actor nombre="Peter Facinelli" representaA="Carlisle"></actor>
    </entrega>
    <entrega numero="5">Amanecer (segunda parte) <actor nombre="Kristen Stewart" representaA="Bella">
            <humano />
        </actor>
        <actor nombre="Robert Pattinson" representaA="Edward">
            <vampiro />
        </actor>
        <actor nombre="Peter Facinelli" representaA="Carlisle"></actor>
    </entrega>

</crepusculo>